Ticker,Description,Asset Class,Asset SubclassSPY,SPDR S&P 500,U.S. Equity,U.S. Large Cap Blend EquityMDY,SPDR MidCap Trust Series I,U.S. Equity,U.S. Mid Cap Blend Equity EWA,iShares MSCI Australia Index Fund,Foreign Developed Equity,Foreign Developed Australia Equity EWC,iShares MSCI Canada Index Fund,Foreign Developed Equity,Foreign Developed Canada EquityEWQ,iShares MSCI France Index Fund,Foreign Developed Equity,Foreign Developed France EquityEWG,iShares MSCI Germany Index Fund,Foreign Developed Equity,Foreign Developed Germany EquityEWH,iShares MSCI Hong Kong Index Fund,Foreign Developed Equity,Foreign Developed Hong Kong EquityEWI,iShares MSCI Italy Index Fund,Foreign Developed Equity,Foreign Developed Italy EquityEWJ,iShares MSCI Japan Index Fund,Foreign Developed Equity,Foreign Developed Japan EquityEWN,iShares MSCI Netherlands Index Fund,Foreign Developed Equity,Foreign Developed Nethrlands Equity EWS,iShares MSCI Singapore Index Fund,Foreign Developed Equity,Foreign Developed Singapore EquityEWP,iShares MSCI Spain Index Fund,Foreign Developed Equity,Foreign Developed Spain Equity EWD,iShares MSCI Sweden Index Fund,Foreign Developed Equity,Foreign Developed Sweden EquityEWL,iShares MSCI Switzerland Index Fund,Foreign Developed Equity,Foreign Developed Switzerland EquityEWU,iShares MSCI United Kingdom Index Fund,Foreign Developed Equity,Foreign Developed United Kingdom EquityEWM,iShares MSCI Malaysia Index Fund,Foreign Emerging Equity,Foreign Emerging Malaysia EquityEWW,iShares MSCI Mexico Index Fund,Foreign Emerging Equity,Foreign Emerging Mexico EquityDIA,SPDR Dow Jones Industrial Average ETF,U.S. Equity,U.S. Large Cap Value EquityXLY,Consumer Discretionary Select Sector SPDR,U.S. Equity,U.S. Consumer Discretionary Sector Equity XLP,Consumer Staples Select Sector SPDR,U.S. Equity,U.S. Consumer Staples Sector Equity XLE,Energy Select Sector SPDR,U.S. Equity,U.S. Energy Sector Equity XLF,Financial Select Sector SPDR,U.S. Equity,U.S. Financial Sector EquityXLV,Health Care Select Sector SPDR,U.S. Equity,U.S. Healthcare Sector Equity XLI,Industrial Select Sector SPDR,U.S. Equity,U.S. Industrial Sector Equity XLB,Materials Select Sector SPDR,U.S. Equity,U.S. Materials Sector Equity XLK,Technology Select Sector SPDR,U.S. Equity,U.S. Technology Sector Equity XLU,Utilities Select Sector SPDR,U.S. Equity,U.S. Utilites Sector Equity QQQ,QQQ,U.S. Equity,U.S. Large Cap Growth EquityEWY,iShares MSCI South Korea Index Fund,Foreign Developed Equity,Foreign Developed South Korea EquityIVV,iShares Core S&P 500 ETF,U.S. Equity,U.S. Large Cap Blend EquityIWB,iShares Russell 1000 Index Fund,U.S. Equity,U.S. Large Cap Blend EquityIYW,iShares Dow Jones U.S. Technology Index Fund,U.S. Equity,U.S. Technology Sector Equity IWV,iShares Russell 3000,U.S. Equity,U.S. All Cap EquityIYZ,iShares Dow Jones U.S. Telecommunications Index Fund,U.S. Equity,U.S. Communications Sector EquityIYF,iShares Dow Jones U.S. Financial Sector Index Fund,U.S. Equity,U.S. Financial Sector EquityIWF,iShares Russell 1000 Growth,U.S. Equity,U.S. Large Cap Growth EquityIVW,iShares S&P 500 Growth Index Fund,U.S. Equity,U.S. Large Cap Growth EquityIWD,iShares Russell 1000 Value,U.S. Equity,U.S. Large Cap Value EquityIVE,iShares S&P 500 Value Index Fund,U.S. Equity,U.S. Large Cap Value EquityIJH,iShares Core S&P Mid-Cap ETF,U.S. Equity,U.S. Mid Cap Core Equity IJR,iShares Core S&P Small-Cap ETF,U.S. Equity,U.S. Small Cap Blend EquityIWM,Russell 2000 Index Fund,U.S. Equity,U.S. Small Cap Blend EquityIYE,iShares Dow Jones U.S. Energy Sector Fund,U.S. Equity,U.S. Energy Sector Equity IYR,Dow Jones U.S. Real Estate Index Fund,Alternative,Alternative U.S. Real Estate Equity IYM,iShares Dow Jones U.S. Basic Materials Index,U.S. Equity,U.S. Materials Sector Equity EWT,iShares MSCI Taiwan Index Fund,Foreign Developed Equity,Foreign Developed Taiwan EquityEWZ,iShares MSCI Brazil Capped ETF,Foreign Emerging Equity,Foreign Emerging Brazil EquityIYJ,iShares Dow Jones U.S. Industrial Sector Index Fund,U.S. Equity,U.S. Industrial Sector Equity IEV,iShares S&P Europe 350 Index Fund,Foreign Developed Equity,Foreign Developed Europe EquityIJK,iShares S&P MidCap 400 Growth Index Fund,U.S. Equity,U.S. Mid Cap Growth EquityIJJ,iShares S&P MidCap 400 Value Index Fund,U.S. Equity,U.S. Mid Cap Value Equity IWO,iShares Russell 2000 Growth,U.S. Equity,U.S. Small Cap Growth Equity IJT,iShares S&P SmallCap 600 Growth Index Fund,U.S. Equity,U.S. Small Cap Growth Equity IWN,iShares Russell 2000 Value Index Fund,U.S. Equity,U.S. Small Cap Value EquityIJS,iShares S&P SmallCap 600 Value Index Fund,U.S. Equity,U.S. Small Cap Value EquityEZU,iShares MSCI EMU Index Fund,Foreign Developed Equity,Foreign Developed Europe EquityOEF,iShares S&P 100 Index Fund,U.S. Equity,U.S. Large Cap Blend EquityICF,iShares Cohen & Steers Realty Major,Alternative,Alternative U.S. Real Estate Equity IBB,iShares Nasdaq Biotechnology,U.S. Equity,U.S. Healthcare Sector Equity VTI,Vanguard Total Stock Market ETF,U.S. Equity,U.S. All Cap EquityIWP,iShares Russell Midcap Growth Index,U.S. Equity,U.S. Mid Cap Growth EquityIWS,iShares Russell Midcap Value Index,U.S. Equity,U.S. Mid Cap Value Equity RWR,SPDR DJ Wilshire REIT ETF,Alternative,Alternative U.S. Real Estate Equity EFA,iShares MSCI EAFE Index Fund,Foreign Developed Equity,Foreign Developed Large Cap Equity IWR,iShares Russell Midcap Index Fund,U.S. Equity,U.S. Mid Cap Blend Equity IGN,iShares S&P North American Technology-Multimedia Networking Index Fund,U.S. Equity,U.S. Technology Sector Equity EPP,iShares MSCI Pacific Ex-Japan Index Fund,Foreign Emerging Equity,Foreign Emerging Pacific ex-Japan EquityIXC,iShares S&P Global Energy Index Fund,Global Equity,Global Energy EquityIGE,iShares S&P North American Natural Resources Sector Index Fund,Global Equity,Global North American Materials Sector EquityVXF,Vanguard Extended Market ETF,U.S. Equity,U.S. Mid Cap Blend Equity SHY,Barclays 1-3 Year Treasury Bond Fund,U.S. Fixed Income,U.S. Government Bond Fixed IncomeTLT,Barclays 20 Year Treasury Bond Fund,U.S. Fixed Income,U.S. Government Bond Fixed IncomeIEF,Barclays 7-10 Year Treasury Bond Fund,U.S. Fixed Income,U.S. Government Bond Fixed IncomeFEZ,SPDR Euro STOXX 50 ETF,Foreign Developed Equity,Foreign Developed Europe Equity EEM,iShares MSCI Emerging Markets Index Fund,Foreign Emerging Equity,Foreign Emerging EquityRSP,Guggenheim S&P Equal Weight ETF,U.S. Equity,U.S. Large Cap Blend EquityILF,iShares Latin America 40 Index Fund,Foreign Emerging Equity,Foreign Emerging Latin America EquityEZA,iShares MSCI South Africa Index Fund,Foreign Emerging Equity,Foreign Emerging South Africa EquityAGG,iShares Core Total U.S. Bond Market ETF,U.S. Fixed Income,U.S. Total Bond Fixed IncomeFVD,First Trust Value Line Dividend Index Fund,U.S. Equity,U.S. Large Cap Value EquityDVY,Dow Jones Select Dividend Index Fund,U.S. Equity,U.S. Large Cap Value EquityTIP,Barclays TIPS Bond Fund,U.S. Fixed Income,U.S. Inflation-Protected Government Bond Fixed IncomeIYT,iShares Dow Jones Transportation Average Index Fund,U.S. Equity,U.S. Industrial Sector EquityITOT,iShares Core S&P Total U.S. Stock Market ETF,U.S. Equity,U.S. All Cap EquityVDC,Vanguard Consumer Staples ETF,U.S. Equity,U.S. Consumer Staples Sector Equity VFH,Vanguard Financials ETF,U.S. Equity,U.S. Financial Sector EquityVHT,Vanguard Health Care ETF,U.S. Equity,U.S. Healthcare Sector Equity VV,Vanguard Large-Cap ETF,U.S. Equity,U.S. Large Cap Blend EquityVUG,Vanguard Growth ETF,U.S. Equity,U.S. Large Cap Growth EquityVTV,VanguardValue ETF,U.S. Equity,U.S. Large Cap Value EquityVO,Vanguard Mid-Cap ETF,U.S. Equity,U.S. Mid Cap Blend Equity VB,Vanguard Small-Cap ETF,U.S. Equity,U.S. Small Cap Blend EquityVBK,Vanguard Small-Cap Growth ETF,U.S. Equity,U.S. Small Cap Growth Equity VBR,Vanguard Small-Cap Value ETF,U.S. Equity,U.S. Small Cap Value EquityVGT,Vanguard Information Tech ETF,U.S. Equity,U.S. Technology Sector Equity VPU,Vanguard Utilities ETF,U.S. Equity,U.S. Utilites Sector Equity VNQ,Vanguard REIT ETF,Alternative,Alternative U.S. Real Estate Equity FXI,FTSE China 25 Index Fund,Foreign Emerging Equity,Foreign Emerging China EquityGLD,SPDR Gold Trust,Alternative,Alternative Commodity Precious Metals PEY,PowerShares High Yield Dividend Achievers,U.S. Equity,U.S. All Cap EquityIAU,COMEX Gold Trust,Alternative,Alternative Commodity Precious Metals PBW,PowerShares WilderHill Clean Energy Portfolio,U.S. Equity,U.S. Energy Sector Equity PWV,PowerShares Dynamic LargeCap Value,U.S. Equity,U.S. Large Cap Value EquityVGK,FTSE Europe ETF,Foreign Developed Equity,Foreign Developed Europe EquityVPL,Vanguard FTSE Pacific ETF,Foreign Emerging Equity,Foreign Emerging Asia Pacific EquityVWO,Vanguard Emerging Markets ETF,Foreign Emerging Equity,Foreign Emerging EquityPBS,PowerShares Dynamic Media,U.S. Equity,U.S. Consumer Discretionary Sector Equity PBJ,PowerShares Dynamic Food & Beverage,U.S. Equity,U.S. Consumer Staples Sector Equity PJP,PowerShares Dynamic Pharmaceuticals,U.S. Equity,U.S. Healthcare Sector Equity EFV,iShares MSCI Value Index Fund,Foreign Developed Equity,Foreign Developed Large Cap Equity PID,PowerShares Intl Dividend Achievers,Foreign Developed Equity,Foreign Developed Large Cap Equity KBE,SPDR S&P Bank ETF,U.S. Equity,U.S. Financial Sector EquityKIE,SPDR S&P Insurance ETF,U.S. Equity,U.S. Financial Sector EquitySDY,SPDR S&P Dividend ETF,U.S. Equity,U.S. Large Cap Value EquityPHO,PowerShares Water Resource Portfolio,Alternative,Alternative Water CommodityFXE,CurrencyShares Euro Currency Trust,Alternative,Alternative Foreign Developed Europe Currency PRF,PowerShares FTSE RAFI US 1000 Portfolio,U.S. Equity,U.S. Large Cap Value EquityDBC,PowerShares DB Commodity Index Tracking Fund,Alternative,Alternative Commodity XHB,SPDR Homebuilders ETF,Alternative,Alternative U.S. Homebuilding Equity XBI,SPDR S&P Biotech ETF,U.S. Equity,U.S. Healthcare Sector Equity FDL,First Trust Morningstar Dividend Leaders Index Fund,U.S. Equity,U.S. Large Cap Value EquityUSO,USCF United States Oil Fund,Alternative,Alternative Commodity Oil SLV,iShares Silver Trust,Alternative,Alternative Commodity Precious Metals VIG,Vanguard Dividend Appreciation ETF,U.S. Equity,U.S. Large Cap Value EquityITB,iShares Dow Jones U.S. Home Construction Index Fund,Alternative,Alternative U.S. Homebuilding Equity IEO,iShares Dow Jones U.S. Oil & Gas Exploration & Production Index Fund,U.S. Equity,U.S. Energy Sector Equity IEZ,iShares Dow Jones U.S. Oil Equipment & Services Index Fund,U.S. Equity,U.S. Energy Sector Equity GDX,Market Vectors TR Gold Miners,Alternative,Alternative Commodity Precious Metals DXJ,WisdomTree Japan Hedged Equity Fund,Foreign Developed Equity,Foreign Developed Japan Leveraged EquityDFJ,WisdomTree Japan SmallCap Fund,Foreign Developed Equity,Foreign Developed Japan Small Cap EquityDLN,WisdomTree LargeCap Dividend Fund,U.S. Equity,U.S. Large Cap Value EquityDOG,ProShares Short Dow30,U.S. Equity,U.S. Inverse EquityPSQ,ProShares Short QQQ,U.S. Equity,U.S. Inverse EquitySH,ProShares Short S&P500,U.S. Equity,U.S. Large Cap Inverse Equity XME,SPDR S&P Metals & Mining ETF,Alternative,Alternative Commodity Precious Metals XRT,SPDR S&P Retail ETF,U.S. Equity,U.S. Consumer Discretionary Sector Equity XES,SPDR S&P Oil & Gas Equip & Service,U.S. Equity,U.S. Energy Sector Equity KRE,SPDR S&P Regional Banking ETF,U.S. Equity,U.S. Financial Sector EquityXOP,SPDR S&P Oil & Gas Explor & Product,U.S. Equity,U.S. Materials Sector Oil EquityFDN,First Trust DJ Internet Index Fund,U.S. Equity,U.S. Technology Sector Equity FXA,CurrencyShares Australian Dollar Trust,Alternative,Alternative Foreign Developed Australian CurrencyGSG,iShares GSCI Commodity-Indexed Trust Fund,Alternative,Alternative Commodity OIL,iPath S&P GSCI Crude Oil Tot Ret Idx ETN,Alternative,Alternative Commodity Oil VOE,Vanguard Mid-Cap Value ETF,U.S. Equity,U.S. Mid Cap Value Equity DBV,PowerShares DB G10 Currency Harvest,Alternative,Alternative Global Developed CurrencyCVY,Gunggenheim Multi-Asset Income ETF,U.S. Equity,U.S. Large Cap Value EquityPSP,ProShares Listed Private Equity,U.S. Equity,U.S. Financial Sector EquityDJP,iPath Dow Jones-UBS Commodity Index TR ETN,Alternative,Alternative Commodity VYM,Vanguard High Dividend Yield ETF,U.S. Equity,U.S. Large Cap Value EquityPKW,PowerShares Buyback Achievers,U.S. Equity,U.S. All Cap EquityDBA,PowerShares DB Agriculture Fund,Alternative,Alternative Commodity Agriculture DBB,PowerShares DB Base Metals Fund,Alternative,Alternative Commodity Base Metals DBO,PowerShares DB Oil Fund,Alternative,Alternative Commodity Oil DBE,PowerShares DB Energy Fund,U.S. Equity,U.S. Energy Sector Equity SHV,Barclays Short Treasury Bond Fund,U.S. Fixed Income,U.S. Government Bond Fixed IncomeIEI,iShares Barclays 3-7 Year Treasury Bond Fund,U.S. Fixed Income,U.S. Government Bond Fixed IncomePGF,PowerShares Financial Preferred Portfolio,U.S. Equity,U.S. Preferred Stock EquitySBB,ProShares Short SmallCap600,U.S. Equity,U.S. Small Cap Inverse EquityRWM,ProShares Short Russell2000,U.S. Equity,U.S. Small Cap Inverse Equity FXY,CurrencyShares Japanese Yen Trust,Alternative,Alternative Foreign Developed Japan Currency UUP,PowerShares DB USD Index Bullish,Alternative,Alternative U.S. Currency PDP,PowerShares DWA Technical Leaders Portfolio,U.S. Equity,U.S. All Cap EquityRWX,SPDR DJ Wilshire Intl Real Estate,Alternative,Alternative Global Real Estate EquityVEU,Vanguard FTSE All World Ex US ETF,Global Equity,Global Foreign EquityMBB,iShares Barclays MBS Bond Fund,U.S. Fixed Income,U.S. Mortgage Backed Security Fixed IncomeGXC,SPDR S&P China ETF,Foreign Emerging Equity,Foreign Emerging China EquityPFF,iShares S&P US Preferred Stock Fund,U.S. Equity,U.S. Preferred Stock EquityBIV,Vanguard Intermediate-Term Bond ETF,U.S. Fixed Income,U.S. Total Bond Fixed IncomeBSV,Vanguard Short-Term Bond ETF,U.S. Fixed Income,U.S. Total Bond Fixed IncomeBND,Vanguard Total Bond Market ETF,U.S. Fixed Income,U.S. Total Bond Fixed IncomeHYG,iBoxx $ High Yield Corporate Bond Fund,U.S. Fixed Income,U.S. High Yield Bond Fixed IncomeUNG,USCF United States Natural Gas Fund LP,Alternative,Alternative Commodity Natural GasGWX,SPDR S&P International SmallCap ETF,Foreign Developed Equity,Foreign Developed Small & Mid Cap EquityGWL,SPDR S&P World ex-US ETF,Global Equity,Global Foreign EquityREM,FTSE NAREIT Mortgage REITs Index Fund,Alternative,Alternative U.S. Real Estate Equity RSX,Market Vectors Russia ETF,Foreign Emerging Equity,Foreign Emerging Russia EquityFRI,First Trust S&P REIT Index Fund,Alternative,Alternative U.S. Real Estate Equity FXD,First Trust Consumer Discretionary AlphaDEX Fund,U.S. Equity,U.S. Consumer Discretionary Sector Equity FXG,First Trust Consumer Staples AlphaDEX Fund,U.S. Equity,U.S. Consumer Staples Sector Equity FXO,First Trust Financials AlphaDEX Fund,U.S. Equity,U.S. Financial Sector EquityFXH,First Trust Health Care AlphaDEX,U.S. Equity,U.S. Healthcare Sector Equity FCG,First Trust ISE-Revere Natural Gas Index Fund,Alternative,Alternative U.S. Materials Sector Natural Gas Equity BIL,SPDR Barclays 1-3 Month T-Bill ETF,U.S. Fixed Income,U.S. Government Bond Fixed IncomeIDV,iShares Dow Jones EPAC Select Dividend,Foreign Developed Equity,Foreign Developed Large Cap Equity DEM,WisdomTree Emerging Markets Equity Income Fund,Foreign Emerging Equity,Foreign Emerging EquityVEA,Vanguard Europe Pacific,Foreign Developed Equity,Foreign Developed Europe EquityMOO,Market Vectors-Agribusiness ETF,Global Equity,Global Materials Sector Equity MUB,iShares S&P National Municipal Bond Fund,U.S. Fixed Income,U.S. Municipal Bond Fixed IncomeTFI,SPDR Barclays Municipal Bond,U.S. Fixed Income,U.S. Municipal Bond Fixed IncomePXH,PowerShares FTSE RAFI Emerging Markets Portfolio,Foreign Emerging Equity,Foreign Emerging EquityPCY,PowerShares Emerging Markets Sovereign Debt Portfolio,Foreign Fixed Income,Foreign Emerging Government Bond Fixed Income BWX,SPDR Barclays Intl Treasury Bond,Global Fixed Income,Global Government Bond Fixed Income SHM,SPDR Barclays Short Term Municipal Bond ETF,U.S. Fixed Income,U.S. Municipal Bond Fixed IncomePZA,PowerShares Insured National Municipal Bond Portfolio,U.S. Fixed Income,U.S. Municipal Bond Fixed IncomeRJI,ELEMENTS Rogers Intl Commodity ETN,Alternative,Alternative Commodity RJA,ELEMENTS Rogers Intl Commodity Agric ETN,Alternative,Alternative Commodity Agriculture EFZ,Short iShares MSCI EAFE,U.S. Equity,U.S. Inverse EquityDGS,WisdomTree Emerging Market SmallCap Fund,Foreign Emerging Equity,Foreign Emerging Small Cap EquityEUM,ProShares Short iShares MSCI Emerging Markets,Foreign Emerging Equity,Foreign Emerging Inverse EquityPHB,PowerShares Fundamental High Yield Corporate Bond Portfolio,U.S. Fixed Income,U.S. High Yield Bond Fixed IncomeBKF,iShares MSCI BRIC Index Fund,Foreign Emerging Equity,Foreign Emerging BRIC EquityECH,iShares MSCI Chile Index Fund,Foreign Emerging Equity,Foreign Emerging Chile EquityITM,Market Vectors-Intermediate Municipal Index ETF,U.S. Fixed Income,U.S. Municipal Bond Fixed IncomeSCZ,iShares MSCI EAFE Small Cap,Foreign Developed Equity,Foreign Developed Small & Mid Cap EquityIGF,iShares S&P Global Infrastructure,Global Equity,Global Infrastruture EquityEMB,JP Morgan Emerging Markets Bond Fund,Foreign Fixed Income,Foreign Emerging Bond Fixed Income IFGL,iShares FTSE EPRA/NAREIT Global Real Estate ex-U.S. Index Fund,Global Equity,Global Foreign Real Estate EquityPBP,PowerShares S&P 500 BuyWrite Portfolio,U.S. Equity,U.S. Long-Short EquityPIZ,PowerShares DWA Developed Market Technical Leaders Portfolio,Foreign Developed Equity,Foreign Developed Large Cap Equity PIE,PowerShares DWA Emerging Market Technical Leaders Portfolio,Foreign Emerging Equity,Foreign Emerging Technology Sector Equity KOL,Market Vectors Coal ETF,Alternative,Alternative Commodity CoalGCC,GreenHaven Continuous Commodity Index Fund,Alternative,Alternative Commodity JNK,SPDR Barclays Capital High Yield Bond ETF,U.S. Fixed Income,U.S. High Yield Bond Fixed IncomeHAO,Guggenheim China Small Cap ETF ,Foreign Emerging Equity,Foreign Emerging China Small Cap EquityPGX,PowerShares Preferred Portfolio,U.S. Equity,U.S. Preferred Stock EquityDWX,SPDR S&P International Dividend ETF,Foreign Developed Equity,Foreign Developed Large Cap Equity EPI,WisdomTree India Earnings Fund,Foreign Emerging Equity,Foreign Emerging India EquityDGZ,PowerShares DB Gold Short ETN,Alternative,Alternative Commodity Precious Metals PIN,PowerShares India Portfolio,Foreign Emerging Equity,Foreign Emerging India EquityWIP,SPDR DB International Government Inflation-Protected Bond ETF,Global Fixed Income,Global Inflation-Protected Government Bond Fixed IncomeACWI,iShares MSCI All Country World Index Fund,Global Equity,Global EquityTHD,iShares MSCI Thailand Index Fund,Foreign Emerging Equity,Foreign Emerging Thailand EquityTUR,iShares MSCI Turkey Investable Market Index Fund,Foreign Emerging Equity,Foreign Emerging Turkey EquityACWX,iShares MSCI ACWI ex US Index Fund,Global Equity,Global Foreign EquityTAN,Guggenheim Solar ETF ,U.S. Equity,U.S. Energy Sector Equity RWO,SPDR DJ Wilshire Global Real Estate ETF,Alternative,Alternative Global Real Estate EquityEWX,SPDR S&P Emerging Markets Small Cap ETF,Foreign Emerging Equity,Foreign Emerging Small Cap EquityVT,Vanguard Total World Stock Index ETF,Global Equity,Global EquityAAXJ,iShares MSCI All Country Asia ex Japan Index Fund,Foreign Emerging Equity,Foreign Emerging Asia EquityIDX,Market Vectors Indonesia Index ETF,Foreign Emerging Equity,Foreign Emerging Indonesia EquityVXX,S&P 500 VIX Short-Term Futures ETN,Alternative,Alternative ST VolatilityHYD,Market Vectors High Yield Municipal Index ETF,U.S. Fixed Income,U.S. Municipal Bond Fixed IncomeGXG,Global X InterBolsa FTSE Colombia 20 ETF,Foreign Emerging Equity,Foreign Emerging Colombia EquityVXZ,iPath S&P 500 VIX Mid-Term Futures ETN,Alternative,Alternative ST VolatilityCWB,SPDR Barclays Capital Convertible Bond ETF,U.S. Fixed Income,U.S. Convertible Bond Fixed IncomeBRF,Market Vectors Brazil Small-Cap ETF,Foreign Emerging Equity,Foreign Emerigng Brazil Small Cap EquityCEW,WisdomTree Dreyfus Emerging Currency Fund,Alternative,Alternative Foreign Emerging CurrencyAMJ,Alerian MLP Index ETN,Alternative,Alternative U.S. MLP EquityEPU,iShares MSCI All Peru Capped Index Fund,Foreign Emerging Equity,Foreign Emerging Peru EquitySIVR,ETFS Physical Silver Shares,Alternative,Alternative Commodity Precious Metals VNM,Market Vectors Vietnam ETF,Foreign Emerging Equity,Foreign Emerging Vietnam EquityTBF,ProShares Short 20+ Year Treasury,U.S. Fixed Income,U.S. Inverse Government Bond Fixed IncomeSTPZ,PIMCO 1-5 Year U.S. TIPS Index Fund,U.S. Fixed Income,U.S. Inflation-Protected Government Bond Fixed IncomeSGOL,ETFS Physical Swiss Gold Shares,Alternative,Alternative Commodity Precious Metals SCHF,Schwab International Equity ETF,Global Equity,Global Large Cap Equity SCHB,Schwab U.S. Broad Market ETF,U.S. Equity,U.S. All Cap EquitySCHX,Schwab U.S. Large-Cap ETF,U.S. Equity,U.S. Large Cap Blend EquitySCHA,Schwab U.S. Small-Cap ETF,U.S. Equity,U.S. Small Cap Blend EquityGDXJ,Market Vectors Junior Gold Miners ETF,Alternative,Alternative Commodity Precious Metals MINT,PIMCO Enhanced Short Maturity Strategy Fund,U.S. Fixed Income,U.S. Money Fixed IncomeBAB,PowerShares Build America Bond Portfolio,U.S. Fixed Income,U.S. Municipal Bond Fixed IncomeINDY,iShares S&P India Nifty Fifty Index Fund,Foreign Emerging Equity,Foreign Emerging India EquityCHIQ,Global X China Consumer ETF,Foreign Emerging Equity,Foreign Emerging China Equity SCHV,Schwab U.S. Large-Cap Value ETF,U.S. Equity,U.S. Large Cap Value EquitySCHG,Schwab U.S. Large-Cap Growth ETF,U.S. Equity,U.S. Large Cap Growth EquityPALL,ETFS Physical Palladium Shares,Alternative,Alternative Commodity Precious Metals SCHE,Schwab Emerging Markets Equity ETF,Foreign Emerging Equity,Foreign Emerging EquityHEDJ,WisdomTree Europe Hedged Equity Fund ,Foreign Developed Equity,Foreign Developed Europe Leveraged EquityPCEF,PowerShares CEF Income Composite Portfolio,U.S. Fixed Income,U.S. Total Bond Fixed IncomeMLPI,E-TRACS Alerian MLP Infrastructure Index,Alternative,Alternative U.S. MLP EquityMLPN,Credit Suisse Cushing 30 MLP Index ETN,Alternative,Alternative U.S. MLP EquitySIL,Global X Silver Miners ETF,Alternative,Alternative Commodity Precious Metals EIDO,iShares MSCI Indonesia Investable Market Index Fund,Foreign Emerging Equity,Foreign Emerging Indonesia EquityEPOL,iShares MSCI Poland Investable Market Index Fund,Foreign Emerging Equity,Foreign Emerging Poland EquityEMLC,Market Vectors Emerging Markets Local Currency Bond ETF,Foreign Fixed Income,Foreign Emerging Bond Fixed Income ELD,WisdomTree Emerging Markets Local Debt Fund,Foreign Fixed Income,Foreign Emerging Bond Fixed Income AMLP,Alerian MLP ETF,Alternative,Alternative U.S. MLP EquitySCIF,Market Vectors India Small-Cap Index ETF,Foreign Emerging Equity,Foreign Emerging India Small Cap EquityECON,EGShares Dow Jones Emerging Markets Consumer Titans Index Fund,Foreign Emerging Equity,Foreign Emerging Consumer Staples Sector Equity GNR,SPDR S&P Global Natural Resources ETF,Global Equity,Global Materials Sector EquityEPHE,iShares MSCI Philippines Investable Market Index Fund,Foreign Emerging Equity,Foreign Emerging Philippine EquityVOO,Vanguard S&P 500 ETF,U.S. Equity,U.S. Large Cap Blend EquitySOXX,PHLX SOX Semiconductor Sector Index Fund,U.S. Equity,U.S. Technology Sector Equity VNQI,Vanguard Global ex-U.S. Real Estate Index Fund,Alternative,Alternative Global Foreign Real Estate Equity ERUS,iShares MSCI Russia Capped Index Fund,Foreign Emerging Equity,Foreign Emerging Russia EquityXIV,Daily Inverse VIX Short-Term ETN,Alternative,Alternative ST VolatilityZIV,VelocityShares Daily Inverse VIX Medium-Term ETN,Alternative,Alternative ST VolatilityVIIX,VelocityShares VIX Short-Term ETN,Alternative,Alternative ST VolatilityVIXY,ProShares VIX Short-Term Futures ETF,Alternative,Alternative ST VolatilitySCHH,Schwab U.S. REIT ETF,Alternative,Alternative U.S. Real Estate Equity SCHM,Schwab U.S. Mid-Cap ETF,U.S. Equity,U.S. Mid Cap Blend Equity BSJF,BulletShares 2015 High Yield Corporate Bond ETF,U.S. Fixed Income,U.S. High Yield Bond Fixed IncomeHDGE,Ranger Active Bear ETF,U.S. Equity,U.S. Inverse EquityVXUS,Vanguard Total International Stock ETF,Global Equity,Global Foreign EquityEDIV,SPDR S&P Emerging Markets Dividend ETF,Foreign Emerging Equity,Foreign Emerging EquityBKLN,PowerShares Senior Loan Portfolio,U.S. Fixed Income,U.S. High Yield Bond Fixed IncomeMCHI,iShares MSCI China Index Fund,Foreign Emerging Equity,Foreign Emerging China EquityHDV,iShares High Dividend Equity Fund,U.S. Equity,U.S. Large Cap Value EquityFEM,First Trust Emerging Markets AlphaDEX Fund,Foreign Emerging Equity,Foreign Emerging EquitySPHB,PowerShares S&P 500 High Beta Portfolio,U.S. Equity,U.S. Large Cap Blend EquitySPLV,S&P 500 Low Volatility Portfolio,U.S. Equity,U.S. Large Cap Blend EquityDBJP,iShares MSCI Japan Hedged Equity Fund,Foreign Developed Equity,Foreign Developed Japan Leveraged EquitySDIV,Global X SuperDividend ETF,Global Equity,Global Equity HYS,PIMCO 0-5 Year High Yield Corporate Bond Index Fund,U.S. Fixed Income,U.S. High Yield Bond Fixed IncomeNKY,MAXIS Nikkei 225 Index ETF,Foreign Developed Equity,Foreign Developed Japan EquityGUNR,FlexShares Morningstar Global Upstream Natural Resources Index Fund ,Global Equity,Global Materials Sector EquityTDTT,iBoxx 3-Year Target Duration TIPS Index Fund ,U.S. Fixed Income,U.S. Inflation-Protected Government Bond Fixed IncomeSVXY,ProShares Short VIX Short-Term Futures ETF,Alternative,Alternative ST Volatility