Ticker,Description,Asset Class,Asset SubclassEFAV,iShares MSCI EAFE Minimum Volatility Index Fund,Foreign Developed Equity,Foreign Developed Large Cap Equity EEMV,iShares MSCI Emerging Markets Minimum Volatility Index Fund,Foreign Emerging Equity,Foreign Emerging EquitySCHD,Schwab US Dividend Equity ETF,U.S. Equity,U.S. All Cap EquityUSMV,iShares MSCI USA Minimum Volatility Index Fund,U.S. Equity,U.S. All Cap EquityKBWB,PowerShares KBW Bank Portfolio,U.S. Equity,U.S. Financial Sector EquityGREK,Global X FTSE Greece 20 ETF,Foreign Emerging Equity,Foreign Emerging Greece EquityOIH,Market Vectors Oil Services ETF,U.S. Equity,U.S. Materials Sector Oil EquitySMH,Market Vectors Semiconductor ETF,U.S. Equity,U.S. Technology Sector Equity PPH,Market Vectors Pharmaceutical ETF,U.S. Equity,U.S. Healthcare Sector Equity BBH,Market Vectors Biotech ETF,U.S. Equity,U.S. Healthcare Sector Equity INDA,iShares MSCI India Index Fund,Foreign Emerging Equity,Foreign Emerging India EquityGOVT,iShares Barclays U.S. Treasury Bond Fund,U.S. Fixed Income,U.S. Government Bond Fixed IncomeBOND,PIMCO Total Return Exchange-Traded Fund+B94,U.S. Fixed Income,U.S. Total Bond Fixed IncomeYMLP,Yorkville High Income MLP ETF,Alternative,Alternative U.S. MLP EquitySJNK,SPDR Barclays Capital Short Term High Yield Bond ETF,U.S. Fixed Income,U.S. High Yield Bond Fixed IncomeHYEM,Market Vectors Emerging Markets High Yield Bond ETF,Foreign Fixed Income,Foreign Emerging High Yield Bond Fixed Income EMLP,First Trust North American Energy Infrastructure Fund,Alternative,Alternative U.S. MLP EquitySDOG,ALPS Sector Dividend Dogs ETF,U.S. Equity,U.S. Large Cap Value EquityMDIV,First Trust Multi-Asset Diversified Income Index Fund,U.S. Equity,U.S. Diversified EquityFM,iShares MSCI Frontier 100 Index Fund,Foreign Emerging Equity,Foreign Emerging EquityVTIP,Vanguard Short-Term Inflation-Protected Securities Index Fund,U.S. Fixed Income,U.S. Inflation-Protected Bond Fixed IncomeIEFA,Core iShares MSCI EAFE ETF,Foreign Developed Equity,Foreign Developed Large Cap Equity IEMG,Core iShares MSCI Emerging Markets ETF,Foreign Emerging Equity,Foreign Emerging Equity